{
  "schema_version": "1.0",
  "generated_at": "2026-05-26T00:00:00Z",
  "reconcile_sla_hours": 168,
  "unmapped_tools_policy": "permissive",
  "servers": {
    "gsc": {
      "display_name": "Google Search Console MCP",
      "runtime": "stdio",
      "version_lock": "none",
      "auth_method": "keychain",
      "auth_config": {
        "keychain_service": "seo-core-gsc"
      },
      "capabilities": [
        "read",
        "rate_limited",
        "cached"
      ],
      "rate_limit": "200 queries per 100 seconds (GSC API quota)",
      "docs_url": "https://developers.google.com/webmaster-tools",
      "tools": [
        {
          "tool_name": "gsc__search_analytics",
          "description": "Query GSC Search Analytics with dimension/filter/aggregation arguments. Canonical use-case: search_analytics_query_page_daily.",
          "category": "search_analytics",
          "used_by_mappings": [
            "gsc-tool-mapping.json"
          ],
          "cost_credits_per_call": 0,
          "cache_ttl_hours": 24
        },
        {
          "tool_name": "gsc__enhanced_search_analytics",
          "description": "Enhanced search analytics with rolling 16-month window + brand split. CTR returned as fraction (0-1); see gsc-tool-mapping.json gscMcpTool description.",
          "category": "search_analytics",
          "used_by_mappings": [
            "gsc-tool-mapping.json"
          ],
          "cost_credits_per_call": 0,
          "cache_ttl_hours": 24
        },
        {
          "tool_name": "gsc__detect_quick_wins",
          "description": "Detect queries ranking 8-20 with sufficient impression volume. CTR returned as percent (0-100); see gsc-tool-mapping.json CTR units note.",
          "category": "search_analytics",
          "used_by_mappings": [
            "gsc-tool-mapping.json"
          ],
          "cost_credits_per_call": 0,
          "cache_ttl_hours": 24
        },
        {
          "tool_name": "gsc__index_inspect",
          "description": "Per-URL Index Inspection API.",
          "category": "index_inspect",
          "used_by_mappings": [
            "gsc-tool-mapping.json"
          ],
          "cost_credits_per_call": 0,
          "cache_ttl_hours": 168
        },
        {
          "tool_name": "gsc__list_sitemaps",
          "description": "List sitemaps registered for the site.",
          "category": "sitemap",
          "used_by_mappings": [
            "gsc-tool-mapping.json"
          ],
          "cost_credits_per_call": 0,
          "cache_ttl_hours": 168
        },
        {
          "tool_name": "gsc__submit_sitemap",
          "description": "Submit a sitemap URL to GSC for re-crawl.",
          "category": "sitemap",
          "used_by_mappings": [
            "gsc-tool-mapping.json"
          ],
          "cost_credits_per_call": 0,
          "cache_ttl_hours": 0
        },
        {
          "tool_name": "gsc__get_sitemap",
          "description": "Fetch sitemap details for a single sitemap URL.",
          "category": "sitemap",
          "used_by_mappings": [
            "gsc-tool-mapping.json"
          ],
          "cost_credits_per_call": 0,
          "cache_ttl_hours": 168
        },
        {
          "tool_name": "gsc__list_sites",
          "description": "List all GSC sites the authenticated principal has access to.",
          "category": "search_analytics",
          "used_by_mappings": [
            "gsc-tool-mapping.json"
          ],
          "cost_credits_per_call": 0,
          "cache_ttl_hours": 720
        }
      ]
    },
    "dataforseo": {
      "display_name": "DataForSEO MCP Server",
      "runtime": "npx",
      "package": "dataforseo-mcp-server",
      "version_lock": "2.8.10",
      "auth_method": "env_var",
      "auth_config": {
        "env_vars": [
          "DATAFORSEO_USERNAME",
          "DATAFORSEO_PASSWORD"
        ]
      },
      "capabilities": [
        "read",
        "paid",
        "rate_limited",
        "cached"
      ],
      "rate_limit": "30 qps account aggregate (SERP); per-endpoint quotas in DFS docs",
      "docs_url": "https://docs.dataforseo.com/",
      "tools": [
        {
          "tool_name": "dataforseo__serp_organic_live_advanced",
          "description": "SERP organic results live (advanced). One of the most cost-heavy DFS endpoints; gated by budget_policy.",
          "category": "serp_scrape",
          "used_by_mappings": [
            "dataforseo-endpoint-mapping.json"
          ],
          "cost_credits_per_call": 0.0035,
          "cache_ttl_hours": 24
        },
        {
          "tool_name": "dataforseo__dataforseo_labs_google_keyword_overview",
          "description": "Labs keyword overview — search volume, KD, CPC, SERP info per keyword.",
          "category": "keyword_research",
          "used_by_mappings": [
            "dataforseo-endpoint-mapping.json"
          ],
          "cost_credits_per_call": 0.0001,
          "cache_ttl_hours": 168
        },
        {
          "tool_name": "dataforseo__dataforseo_labs_google_keywords_for_site",
          "description": "Labs keywords-for-site — list of keywords a domain ranks for.",
          "category": "keyword_research",
          "used_by_mappings": [
            "dataforseo-endpoint-mapping.json"
          ],
          "cost_credits_per_call": 0.0001,
          "cache_ttl_hours": 168
        },
        {
          "tool_name": "dataforseo__keywords_data_google_ads_search_volume",
          "description": "Google Ads search volume per keyword (with locale).",
          "category": "keyword_research",
          "used_by_mappings": [
            "dataforseo-endpoint-mapping.json"
          ],
          "cost_credits_per_call": 0.0001,
          "cache_ttl_hours": 168
        },
        {
          "tool_name": "dataforseo__backlinks_summary",
          "description": "Domain-level backlinks summary (referring domains, rank, organic keywords).",
          "category": "backlinks",
          "used_by_mappings": [
            "dataforseo-endpoint-mapping.json"
          ],
          "cost_credits_per_call": 0.0002,
          "cache_ttl_hours": 168
        },
        {
          "tool_name": "dataforseo__on_page_lighthouse",
          "description": "Lighthouse audit for a single page (paid).",
          "category": "page_audit",
          "used_by_mappings": [
            "dataforseo-endpoint-mapping.json"
          ],
          "cost_credits_per_call": 0.005,
          "cache_ttl_hours": 24
        },
        {
          "tool_name": "dataforseo__on_page_instant_pages",
          "description": "On-page instant analysis (cheaper than full crawl).",
          "category": "page_audit",
          "used_by_mappings": [
            "dataforseo-endpoint-mapping.json"
          ],
          "cost_credits_per_call": 0.001,
          "cache_ttl_hours": 24
        },
        {
          "tool_name": "dataforseo__business_data_business_listings_search",
          "description": "Business listings search — local pack / GBP audit data source.",
          "category": "domain_analytics",
          "used_by_mappings": [
            "dataforseo-endpoint-mapping.json"
          ],
          "cost_credits_per_call": 0.001,
          "cache_ttl_hours": 168
        },
        {
          "tool_name": "dataforseo__ai_optimization_llm_response",
          "description": "Cross-LLM response query (ChatGPT/Claude/Gemini/Perplexity citations).",
          "category": "ai_optimization",
          "used_by_mappings": [
            "dataforseo-endpoint-mapping.json"
          ],
          "cost_credits_per_call": 0.002,
          "cache_ttl_hours": 168
        },
        {
          "tool_name": "dataforseo__dataforseo_labs_google_keyword_ideas",
          "description": "Labs keyword ideas — seed-expanded keyword candidates with search volume + KD.",
          "category": "keyword_research",
          "cost_credits_per_call": 0.0001,
          "cache_ttl_hours": 168,
          "notes": "Skill-referenced DataForSEO tool added for registry completeness (P0-03)."
        },
        {
          "tool_name": "dataforseo__dataforseo_labs_google_keyword_suggestions",
          "description": "Labs keyword suggestions — long-tail keyword suggestions for a seed phrase.",
          "category": "keyword_research",
          "cost_credits_per_call": 0.0001,
          "cache_ttl_hours": 168,
          "notes": "Skill-referenced DataForSEO tool added for registry completeness (P0-03)."
        },
        {
          "tool_name": "dataforseo__dataforseo_labs_google_related_keywords",
          "description": "Labs related keywords — semantically related terms (depth-expanded) for a seed.",
          "category": "keyword_research",
          "cost_credits_per_call": 0.0001,
          "cache_ttl_hours": 168,
          "notes": "Skill-referenced DataForSEO tool added for registry completeness (P0-03)."
        },
        {
          "tool_name": "dataforseo__dataforseo_labs_search_intent",
          "description": "Labs search intent — informational/navigational/commercial/transactional classification per keyword.",
          "category": "keyword_research",
          "cost_credits_per_call": 0.0001,
          "cache_ttl_hours": 168,
          "notes": "Skill-referenced DataForSEO tool added for registry completeness (P0-03)."
        },
        {
          "tool_name": "dataforseo__dataforseo_labs_google_historical_keyword_data",
          "description": "Labs historical keyword data — month-by-month search volume history per keyword.",
          "category": "keyword_research",
          "cost_credits_per_call": 0.0001,
          "cache_ttl_hours": 168,
          "notes": "Skill-referenced DataForSEO tool added for registry completeness (P0-03)."
        },
        {
          "tool_name": "dataforseo__dataforseo_labs_google_competitors_domain",
          "description": "Labs competitors-domain — SERP competitor domains for a target domain.",